### ISSUE TITLE
Trying to use geckodriver with Selenium the new session command is returning a 503 HTTP response

### ISSUE THREAD

**Issue by sci-42ver** [mozilla/geckodriver#2227]
Version info:
- OS: Arch Linux 6.13.6-arch1-1
- Firefox: 138.0.4
- geckodriver: 0.36.0
- Python: 3.13.2
- selenium: 4.32.0

Possible needed info as https://github.com/mozilla/geckodriver/issues/2224#issuecomment-2782102715 says:
- window manager: sddm 0.21.0.14.gae072f9-3 shown with `yay -Qs sddm`
- Wayland with Kde

Running in `python -q`
```python
import logging
import sys

from selenium import webdriver
from selenium.webdriver.firefox.options import Options
from selenium.webdriver.firefox.service import Service

logging.basicConfig(level=logging.DEBUG)

opts = Options()
opts.log.level = "trace"
service = Service(log_output=sys.stdout)
driver = webdriver.Firefox(options=opts, service=service)
```
generates log
```bash
DEBUG:selenium.webdriver.common.selenium_manager:Selenium Manager binary found at: /home/hervey_arch/main-env/lib/python3.13/site-packages/selenium/webdriver/common/linux/selenium-manager
DEBUG:selenium.webdriver.common.selenium_manager:Executing process: /home/hervey_arch/main-env/lib/python3.13/site-packages/selenium/webdriver/common/linux/selenium-manager --browser firefox --debug --language-binding python --output json
DEBUG:selenium.webdriver.common.selenium_manager:Found geckodriver 0.36.0 in PATH: /usr/bin/geckodriver
DEBUG:selenium.webdriver.common.selenium_manager:firefox detected at /usr/bin/firefox
DEBUG:selenium.webdriver.common.selenium_manager:Running command: /usr/bin/firefox -v
DEBUG:selenium.webdriver.common.selenium_manager:Output: "Mozilla Firefox 138.0.4"
DEBUG:selenium.webdriver.common.selenium_manager:Detected browser: firefox 138.0.4
DEBUG:selenium.webdriver.common.selenium_manager:Required driver: geckodriver 0.36.0
DEBUG:selenium.webdriver.common.selenium_manager:Driver path: /usr/bin/geckodriver
DEBUG:selenium.webdriver.common.selenium_manager:Browser path: /usr/bin/firefox
DEBUG:selenium.webdriver.common.service:Started executable: `/usr/bin/geckodriver` in a child process with pid: 85194 using 0 to output <_io.TextIOWrapper name='<stdout>' mode='w' encoding='utf-8'>
1748356315655   geckodriver     INFO    Listening on 127.0.0.1:59953
DEBUG:selenium.webdriver.remote.remote_connection:POST http://localhost:59953/session {'capabilities': {'firstMatch': [{}], 'alwaysMatch': {'browserName': 'firefox', 'acceptInsecureCerts': True, 'moz:debuggerAddress': True, 'pageLoadStrategy': <PageLoadStrategy.normal: 'normal'>, 'browserVersion': None, 'moz:firefoxOptions': {'binary': '/usr/bin/firefox', 'prefs': {'remote.active-protocols': 1}, 'log': {'level': 'trace'}}}}}
DEBUG:urllib3.connectionpool:Starting new HTTP connection (1): 127.0.0.1:1081
DEBUG:urllib3.connectionpool:http://127.0.0.1:1081 "POST http://localhost:59953/session HTTP/1.1" 503 0
DEBUG:selenium.webdriver.remote.remote_connection:Remote response: status=503 | data= | headers=HTTPHeaderDict({'Connection': 'close', 'Proxy-Connection': 'close', 'Content-Length': '0'})
DEBUG:selenium.webdriver.remote.remote_connection:Finished Request
Traceback (most recent call last):
  File "<python-input-0>", line 13, in <module>
    driver = webdriver.Firefox(options=opts, service=service)
  File "/home/hervey_arch/main-env/lib/python3.13/site-packages/selenium/webdriver/firefox/webdriver.py", line 71, in __init__
    super().__init__(command_executor=executor, options=options)
    ~~~~~~~~~~~~~~~~^^^^^^^^^^^^^^^^^^^^^^^^^^^^^^^^^^^^^^^^^^^^
  File "/home/hervey_arch/main-env/lib/python3.13/site-packages/selenium/webdriver/remote/webdriver.py", line 260, in __init__
    self.start_session(capabilities)
    ~~~~~~~~~~~~~~~~~~^^^^^^^^^^^^^^
  File "/home/hervey_arch/main-env/lib/python3.13/site-packages/selenium/webdriver/remote/webdriver.py", line 357, in start_session
    response = self.execute(Command.NEW_SESSION, caps)["value"]
               ~~~~~~~~~~~~^^^^^^^^^^^^^^^^^^^^^^^^^^^
  File "/home/hervey_arch/main-env/lib/python3.13/site-packages/selenium/webdriver/remote/webdriver.py", line 448, in execute
    self.error_handler.check_response(response)
    ~~~~~~~~~~~~~~~~~~~~~~~~~~~~~~~~~^^^^^^^^^^
  File "/home/hervey_arch/main-env/lib/python3.13/site-packages/selenium/webdriver/remote/errorhandler.py", line 196, in check_response
    raise exception_class(value)
selenium.common.exceptions.WebDriverException: Message: 
```

I posted originally in selenium but the maintainer there says it is probably not one selenium bug https://github.com/SeleniumHQ/selenium/issues/15763#issuecomment-2912662002.

**Comment by whimboo** [comment]
This log is indeed not that helpful - why is the exception message empty? Please take a look at our docs in how to [create a trace log](https://firefox-source-docs.mozilla.org/testing/geckodriver/TraceLogs.html). It will help to identify if it's an issue with geckodriver/Firefox or Selenium itself. Thanks.

**Comment by cgoldberg** [comment]
@whimboo I think he actually has logging configured correctly, but no trace logs are produced because the initial request to geckodriver returns a 503 and Selenium just raises an error and dies.

**Comment by whimboo** [comment]
What does `logging.basicConfig(level=logging.DEBUG)` vs. `opts.log.level = "trace"` actually mean? Does the latter as well enable trace logging for the driver or only for Firefox? geckodriver should always log trace lines at the beginning even when at some point the first HTTP request fails. 

If that indeed doesn't produce anything helpful it would be good to get a network level log from eg. Wireshark to see which network request actually failed.

**Comment by sci-42ver** [comment]
> This log is indeed not that helpful - why is the exception message empty? Please take a look at our docs in how to [create a trace log](https://firefox-source-docs.mozilla.org/testing/geckodriver/TraceLogs.html). It will help to identify if it's an issue with geckodriver/Firefox or Selenium itself. Thanks.

The codes above are same as https://firefox-source-docs.mozilla.org/testing/geckodriver/TraceLogs.html#python except using stdout as the output instead of one file.

If just use the same demo as the doc, no geckodriver.log is generated.

**Comment by sci-42ver** [comment]
> What does `logging.basicConfig(level=logging.DEBUG)` vs. `opts.log.level = "trace"` actually mean? 

https://docs.python.org/3/library/logging.html#logging-levels. I follow cgoldberg setting and actually my original test codes are borrowed from his comment https://github.com/mozilla/geckodriver/issues/2224#issuecomment-2784748445.

> Does the latter as well enable trace logging for the driver or only for Firefox? 

That is from your offered doc to configure `moz:firefoxOptions` in Python. The doc says "geckodriver accepts a Mozilla-specific configuration object in [moz:firefoxOptions](https://searchfox.org/mozilla-central/source/testing/geckodriver/README.md#firefox-capabilities)."

> If that indeed doesn't produce anything helpful it would be good to get a network level log from eg. Wireshark to see which network request actually failed.

@whimboo Wireshark captures nothing when I run the above script. It only shows ARP packets whose source or destination is the router Sender TpLinkTechno_xx:9e:xx. 

But it shows TCP packets afterwards with info maybe due to delay. I stopped capture after some time when the capture doesn't change. I used filter `tcp.port == 50949 || udp.port == 50949` where 50949 is the listen port of geckodriver, but nothing is left. Is my test fine? If not, please tell me.

All these tests are done with only one terminal and wireshark being opened. If you need more information like capture file, please tell me.

**Comment by cgoldberg** [comment]
> What does `logging.basicConfig(level=logging.DEBUG)` vs. `opts.log.level = "trace"` actually mean?

This first enables all Python logging, so driver logs are included. The latter sets the level of Firefox logging to "trace".

> geckodriver should always log trace lines at the beginning even when at some point the first HTTP request fails

The first log message from geckodriver is:

```
geckodriver     INFO    Listening on 127.0.0.1:53213
```

Immediately after that, a POST request is sent from the driver, and a 503 is returned, so the driver stops.

On my machine (where everything works fine), the 2nd log message is:

```
mozrunner::runner       INFO    Running command: ...
```

In OP's case, it never reaches that point.

**Comment by whimboo** [comment]
@sci-42ver hm may there be some Firewall etc which might deny any local TCP connection as required by geckodriver? That's the only thing I could imagine here.

**Comment by whimboo** [comment]
Also your `localhost` is correctly setup?

**Comment by cgoldberg** [comment]
Wouldn't a 503 mean that geckodriver actually responded to the request? I would expect a socket error if it just couldn't reach it.

**Comment by sci-42ver** [comment]
> Also your `localhost` is correctly setup?

With this notice, I found my former Wireshark capture doesn't contain anything with localhost or 127.0.0.1 which is configured in `/etc/hosts`.

Then I found we need to set interface as https://www.linuxquestions.org/questions/linux-networking-3/capturing-loopback-with-tcpdump-507737/#post2532414 shows which can be done similarly with `tshark -i lo ...`. For GUI, that is not done with filter but with Capture Options. 

So for
> hm may there be some Firewall etc which might deny any local TCP connection as required by geckodriver?

It is not Firewall but _interface_ config error. Sorry for my negligence.

Then I run the above script after using Wireshark to capture the *loopback interface*. Here I give one full test process in one place to read more easily.
```bash
# terminal 1
$ tshark1(){tshark -e _ws.col.number -e _ws.col.Source -e _ws.col.Destination -e tcp.srcport -e tcp.dstport -e udp.srcport  -e udp.dstport -e ip.proto -e _ws.col.Protocol -e _ws.col.Length -e _ws.col.Info -Tfields $@}
$ tshark1 -f 'tcp || udp' -i lo > work1.log
# terminal 2
$ python -c 'import logging
import sys

from selenium import webdriver
from selenium.webdriver.firefox.options import Options
from selenium.webdriver.firefox.service import Service

logging.basicConfig(level=logging.DEBUG)

opts = Options()
opts.log.level = "trace"
service = Service(log_output=sys.stdout)
driver = webdriver.Firefox(options=opts, service=service)'
DEBUG:selenium.webdriver.common.selenium_manager:Selenium Manager binary found at: /home/hervey_arch/main-env/lib/python3.13/site-packages/selenium/webdriver/common/linux/selenium-manager
DEBUG:selenium.webdriver.common.selenium_manager:Executing process: /home/hervey_arch/main-env/lib/python3.13/site-packages/selenium/webdriver/common/linux/selenium-manager --browser firefox --debug --language-binding python --output json
DEBUG:selenium.webdriver.common.selenium_manager:Found geckodriver 0.36.0 in PATH: /usr/bin/geckodriver
DEBUG:selenium.webdriver.common.selenium_manager:firefox detected at /usr/bin/firefox
DEBUG:selenium.webdriver.common.selenium_manager:Running command: /usr/bin/firefox -v
DEBUG:selenium.webdriver.common.selenium_manager:Output: "Mozilla Firefox 139.0"
DEBUG:selenium.webdriver.common.selenium_manager:Detected browser: firefox 139.0
DEBUG:selenium.webdriver.common.selenium_manager:Required driver: geckodriver 0.36.0
DEBUG:selenium.webdriver.common.selenium_manager:Driver path: /usr/bin/geckodriver
DEBUG:selenium.webdriver.common.selenium_manager:Browser path: /usr/bin/firefox
DEBUG:selenium.webdriver.common.service:Started executable: `/usr/bin/geckodriver` in a child process with pid: 81344 using 0 to output <_io.TextIOWrapper name='<stdout>' mode='w' encoding='utf-8'>
1748534656184   geckodriver     INFO    Listening on 127.0.0.1:50103
DEBUG:selenium.webdriver.remote.remote_connection:POST http://localhost:50103/session {'capabilities': {'firstMatch': [{}], 'alwaysMatch': {'browserName': 'firefox', 'acceptInsecureCerts': True, 'moz:debuggerAddress': True, 'pageLoadStrategy': <PageLoadStrategy.normal: 'normal'>, 'browserVersion': None, 'moz:firefoxOptions': {'binary': '/usr/bin/firefox', 'prefs': {'remote.active-protocols': 1}, 'log': {'level': 'trace'}}}}}
DEBUG:urllib3.connectionpool:Starting new HTTP connection (1): 127.0.0.1:1081
DEBUG:urllib3.connectionpool:http://127.0.0.1:1081 "POST http://localhost:50103/session HTTP/1.1" 503 0
DEBUG:selenium.webdriver.remote.remote_connection:Remote response: status=503 | data= | headers=HTTPHeaderDict({'Connection': 'close', 'Proxy-Connection': 'close', 'Content-Length': '0'})
DEBUG:selenium.webdriver.remote.remote_connection:Finished Request
Traceback (most recent call last):
  File "<string>", line 13, in <module>
    driver = webdriver.Firefox(options=opts, service=service)
  File "/home/hervey_arch/main-env/lib/python3.13/site-packages/selenium/webdriver/firefox/webdriver.py", line 71, in __init__
    super().__init__(command_executor=executor, options=options)
    ~~~~~~~~~~~~~~~~^^^^^^^^^^^^^^^^^^^^^^^^^^^^^^^^^^^^^^^^^^^^
  File "/home/hervey_arch/main-env/lib/python3.13/site-packages/selenium/webdriver/remote/webdriver.py", line 260, in __init__
    self.start_session(capabilities)
    ~~~~~~~~~~~~~~~~~~^^^^^^^^^^^^^^
  File "/home/hervey_arch/main-env/lib/python3.13/site-packages/selenium/webdriver/remote/webdriver.py", line 357, in start_session
    response = self.execute(Command.NEW_SESSION, caps)["value"]
               ~~~~~~~~~~~~^^^^^^^^^^^^^^^^^^^^^^^^^^^
  File "/home/hervey_arch/main-env/lib/python3.13/site-packages/selenium/webdriver/remote/webdriver.py", line 448, in execute
    self.error_handler.check_response(response)
    ~~~~~~~~~~~~~~~~~~~~~~~~~~~~~~~~~^^^^^^^^^^
  File "/home/hervey_arch/main-env/lib/python3.13/site-packages/selenium/webdriver/remote/errorhandler.py", line 196, in check_response
    raise exception_class(value)
selenium.common.exceptions.WebDriverException: Message: 
```
Then we check log
```bash
# terminal 1
$ grep 50103 work1.log
11      ::1     ::1     35770   50103                           TCP     94      35770 → 50103 [SYN] Seq=0 Win=65476 Len=0 MSS=65476 SACK_PERM TSval=404758894 TSecr=0 WS=128
12      ::1     ::1     50103   35770                           TCP     74      50103 → 35770 [RST, ACK] Seq=1 Ack=1 Win=0 Len=0
13      127.0.0.1       127.0.0.1       37958   50103                   6       TCP     74      37958 → 50103 [SYN] Seq=0 Win=65495 Len=0 MSS=65495 SACK_PERM TSval=169850666 TSecr=0 WS=128
14      127.0.0.1       127.0.0.1       50103   37958                   6       TCP     54      50103 → 37958 [RST, ACK] Seq=1 Ack=1 Win=0 Len=0
19      ::1     ::1     35778   50103                           TCP     94      35778 → 50103 [SYN] Seq=0 Win=65476 Len=0 MSS=65476 SACK_PERM TSval=404758904 TSecr=0 WS=128
20      ::1     ::1     50103   35778                           TCP     74      50103 → 35778 [RST, ACK] Seq=1 Ack=1 Win=0 Len=0
21      127.0.0.1       127.0.0.1       37972   50103                   6       TCP     74      37972 → 50103 [SYN] Seq=0 Win=65495 Len=0 MSS=65495 SACK_PERM TSval=169850676 TSecr=0 WS=128
22      127.0.0.1       127.0.0.1       50103   37972                   6       TCP     74      50103 → 37972 [SYN, ACK] Seq=0 Ack=1 Win=65483 Len=0 MSS=65495 SACK_PERM TSval=169850676 TSecr=169850676 WS=128
23      127.0.0.1       127.0.0.1       37972   50103                   6       TCP     66      37972 → 50103 [ACK] Seq=1 Ack=1 Win=65536 Len=0 TSval=169850676 TSecr=169850676
24      127.0.0.1       127.0.0.1       37972   50103                   6       TCP     66      37972 → 50103 [FIN, ACK] Seq=1 Ack=1 Win=65536 Len=0 TSval=169850676 TSecr=169850676
25      127.0.0.1       127.0.0.1       50103   37972                   6       TCP     66      50103 → 37972 [FIN, ACK] Seq=1 Ack=2 Win=65536 Len=0 TSval=169850677 TSecr=169850676
26      127.0.0.1       127.0.0.1       37972   50103                   6       TCP     66      37972 → 50103 [ACK] Seq=2 Ack=2 Win=65536 Len=0 TSval=169850677 TSecr=169850677
30      127.0.0.1       127.0.0.1       56276   1081                    6       TCP     325     POST http://localhost:50103/session HTTP/1.1 
32      127.0.0.1       127.0.0.1       56276   1081                    6       HTTP/JSON       381     POST http://localhost:50103/session HTTP/1.1 , JSON (application/json)
62      127.0.0.1       127.0.0.1       56280   1081                    6       HTTP    215     GET http://localhost:50103/shutdown HTTP/1.1
$ grep 56276 work1.log
27      127.0.0.1       127.0.0.1       56276   1081                    6       TCP     74      56276 → 1081 [SYN] Seq=0 Win=65495 Len=0 MSS=65495 SACK_PERM TSval=169850677 TSecr=0 WS=128
28      127.0.0.1       127.0.0.1       1081    56276                   6       TCP     74      1081 → 56276 [SYN, ACK] Seq=0 Ack=1 Win=65483 Len=0 MSS=65495 SACK_PERM TSval=169850677 TSecr=169850677 WS=128
29      127.0.0.1       127.0.0.1       56276   1081                    6       TCP     66      56276 → 1081 [ACK] Seq=1 Ack=1 Win=65536 Len=0 TSval=169850677 TSecr=169850677
30      127.0.0.1       127.0.0.1       56276   1081                    6       TCP     325     POST http://localhost:50103/session HTTP/1.1 
31      127.0.0.1       127.0.0.1       1081    56276                   6       TCP     66      1081 → 56276 [ACK] Seq=1 Ack=260 Win=65280 Len=0 TSval=169850677 TSecr=169850677
32      127.0.0.1       127.0.0.1       56276   1081                    6       HTTP/JSON       381     POST http://localhost:50103/session HTTP/1.1 , JSON (application/json)
33      127.0.0.1       127.0.0.1       1081    56276                   6       TCP     66      1081 → 56276 [ACK] Seq=1 Ack=575 Win=65024 Len=0 TSval=169850677 TSecr=169850677
34      127.0.0.1       127.0.0.1       1081    56276                   6       TCP     100     HTTP/1.1 503 Service Unavailable 
35      127.0.0.1       127.0.0.1       56276   1081                    6       TCP     66      56276 → 1081 [ACK] Seq=575 Ack=35 Win=65536 Len=0 TSval=169850678 TSecr=169850678
# duplicately HTTP/1.1 503 Service Unavailable and the responding ACK
...
54      127.0.0.1       127.0.0.1       1081    56276                   6       HTTP    68      HTTP/1.1 503 Service Unavailable 
55      127.0.0.1       127.0.0.1       56276   1081                    6       TCP     66      56276 → 1081 [ACK] Seq=575 Ack=100 Win=65536 Len=0 TSval=169850678 TSecr=169850678
56      127.0.0.1       127.0.0.1       1081    56276                   6       TCP     66      1081 → 56276 [FIN, ACK] Seq=100 Ack=575 Win=65536 Len=0 TSval=169850678 TSecr=169850678
57      127.0.0.1       127.0.0.1       56276   1081                    6       TCP     66      56276 → 1081 [FIN, ACK] Seq=575 Ack=101 Win=65536 Len=0 TSval=169850679 TSecr=169850678
58      127.0.0.1       127.0.0.1       1081    56276                   6       TCP     66      1081 → 56276 [ACK] Seq=101 Ack=576 Win=65536 Len=0 TSval=169850679 TSecr=169850679
$ grep 56280 work1.log
59      127.0.0.1       127.0.0.1       56280   1081                    6       TCP     74      56280 → 1081 [SYN] Seq=0 Win=65495 Len=0 MSS=65495 SACK_PERM TSval=169850686 TSecr=0 WS=128
60      127.0.0.1       127.0.0.1       1081    56280                   6       TCP     74      1081 → 56280 [SYN, ACK] Seq=0 Ack=1 Win=65483 Len=0 MSS=65495 SACK_PERM TSval=169850686 TSecr=169850686 WS=128
61      127.0.0.1       127.0.0.1       56280   1081                    6       TCP     66      56280 → 1081 [ACK] Seq=1 Ack=1 Win=65536 Len=0 TSval=169850686 TSecr=169850686
62      127.0.0.1       127.0.0.1       56280   1081                    6       HTTP    215     GET http://localhost:50103/shutdown HTTP/1.1 
63      127.0.0.1       127.0.0.1       1081    56280                   6       TCP     66      1081 → 56280 [ACK] Seq=1 Ack=150 Win=65408 Len=0 TSval=169850686 TSecr=169850686
64      127.0.0.1       127.0.0.1       1081    56280                   6       TCP     100     HTTP/1.1 503 Service Unavailable
... Similar to the above
```

As you can see, it seems that selenium tries many times until geckodriver can work. Then both sides send FIN to finish (I temporarily haven't systematically learnt Computer Network. I followed https://superuser.com/a/1841603/1658455 to understand part of the above.). Since the driver has been ready, `http://localhost:50103/session` is requested but it receives 503 and then receives FIN. That is similar to `http://localhost:50103/shutdown`. 

> Wouldn't a 503 mean that geckodriver actually responded to the request?

The problem is due to it sends to one wrong port 1081 which is one proxy I set before with env `http_proxy` and `https_proxy`. It is that proxy sends 503.

With those env's unset, it works with most are similar to the above except returning something like "977     HTTP/1.1 200 OK , JSON (application/json)".

I don't know why the proxy generates 503 error. Anyway proxy can be set inside selenium. I will use that option customization instead of proxy env in the shell.

Thanks for your help.

**Comment by whimboo** [comment]
That is good to hear that everything is working now. Glad we figured it out. I've updated the summary as well to make this issue easier to find in case someone else will trap into a similar issue.
